<?xml version="1.0"  encoding="utf-8" ?>
<LanguageDefinitions
  xmlns="http://gnu.org"
  xmlns:xsi="http://www.w3.org/2001/XMLSchema-instance"
  xsi:schemaLocation="http://gnu.org ..\..\..\Sigma.Specification\LanguageSchema\LanguageDefinition.xsd" >

  <LanguageDefinition Name="SQL">
    
    <MetadataDefinition OpenBracket="(" CloseBracket=")" Prioritizer="BracketPrioritizer" />

    <LogicalOperatorDefinitions>
      <LogicalOperatorDefinition Operator="{AND}"  Implementation="{0} AND {1}"/>
      <LogicalOperatorDefinition Operator="{OR}" Implementation="{0} OR {1}" />
      <LogicalOperatorDefinition Operator="{NOT}" Implementation="NOT {0}" />
    </LogicalOperatorDefinitions>
    
    <PredicateDefinitions>
      <PredicateDefinition Operator="{Equal}" Implementation="{0} = {1}"/>
      <PredicateDefinition Operator="{NotEqual}" Implementation="{0} != {1}"/>
      <PredicateDefinition Operator="{Less}" Implementation="{0} &#60; {1}"/>
      <PredicateDefinition Operator="{Greater}" Implementation="{0} > {1}"/>
      <PredicateDefinition Operator="{LessOrEqual}" Implementation="{0} &#60;= {1}" />
      <PredicateDefinition Operator="{GreaterOrEqual}" Implementation="{0} >= {1}" />
      <PredicateDefinition Operator="{Between}" Implementation=" {0} BETWEEN {1} AND {2}"/>
      <PredicateDefinition Operator="{HasSubstring}" Implementation="{0} like %{1}%"/>
      <PredicateDefinition Operator="{IsSubstring}" Implementation="{1} like %{0}%"/>
      <PredicateDefinition Operator="{IsZero}" Implementation="{0} = 0"/>
      <PredicateDefinition Operator="{In}" Implementation="{0} in {1}"/>
      <PredicateDefinition Operator="{Truth}" Implementation="TRUE"/>
      <PredicateDefinition Operator="{Falsehood}" Implementation="FALSE"/>
    </PredicateDefinitions>
  </LanguageDefinition>

  <LanguageDefinition Name="Armenian">

    <MetadataDefinition OpenBracket="(" CloseBracket=")" Prioritizer="BracketPrioritizer" />

    <LogicalOperatorDefinitions>
      <LogicalOperatorDefinition Operator="{AND}"  Implementation="{0} և {1}"/>
      <LogicalOperatorDefinition Operator="{OR}" Implementation="{0} կամ {1}" />
    </LogicalOperatorDefinitions>

    <PredicateDefinitions>
      <PredicateDefinition Operator="{Equal}" Implementation="{0}-ը հավասար է {1}-ի"/>
      <PredicateDefinition Operator="{Less}" Implementation="{0}-ը փոքր է {1}-ից"/>
      <PredicateDefinition Operator="{IsZero}" Implementation="{0}-ը զրո է"/>
    </PredicateDefinitions>
  </LanguageDefinition>
</LanguageDefinitions> 
